<?xml version="1.0" encoding="UTF-8"?>
<LifeformClass faction="Enemies" name="Dummy Orc"
	xmlns:xsi="http://www.w3.org/2001/XMLSchema-instance"
	xsi:noNamespaceSchemaLocation="../../XMLFiles/Schemas/LifeformClasses.xsd">

	<AnimationClass filename="Demo/AnimationClasses/Orc.xml" />
	<Stats level="86">
		<Levelize lowBound="-1" mul="50" upBound="1">
			<Stat name="MaxHP" />
			<Stat name="MaxMana" />
		</Levelize>
		<Levelize lowBound="-1" mul="5" upBound="1">
			<Stat name="Pdef" />
			<Stat name="Patk" />
			<Stat name="Matk" />
			<Stat name="Mdef" />
		</Levelize>
	</Stats>
	<AI>
		<General type="Passive">
			<Setting name="aggroRange" value="300" />
			<Setting name="driftRange" value="600" />
		</General>
		<Movement type="Idle" />
	</AI>
</LifeformClass>
